{
	"$type": "org.prodid.entity",
	"version": 1,
	"opid": "kq7m3v9dn2hb4t5x",
	"kind": "item",
	"parents": {
		"family": "3n7k2q9vdfhb4mta",
		"variant": "9p2d4kv7mq3nbhxf"
	},
	"identifiers": [
		{
			"scheme": "gtin",
			"value": "09506000134352"
		},
		{
			"scheme": "mpn",
			"value": "TJ-2041-NVY-M",
			"scope": "acme"
		},
		{
			"scheme": "sku",
			"value": "TJ-2041-NVY-M",
			"scope": "acme.example"
		}
	],
	"claims": [
		{
			"property": "name",
			"value": "Trail Jacket",
			"lang": "en",
			"source": {
				"name": "acme.example",
				"trust": "verified",
				"lapsed": false
			},
			"seen_at": "2026-09-14T09:12:03Z"
		},
		{
			"property": "brand",
			"value": "Acme",
			"source": {
				"name": "acme.example",
				"trust": "verified",
				"lapsed": false
			},
			"seen_at": "2026-09-14T09:12:03Z"
		},
		{
			"property": "properties.material",
			"value": "100% recycled polyester",
			"lang": "en",
			"source": {
				"name": "acme.example",
				"trust": "verified",
				"lapsed": false
			},
			"seen_at": "2026-09-14T09:12:03Z"
		},
		{
			"property": "properties.weight",
			"value": {
				"value": 480,
				"unit": "g"
			},
			"source": {
				"name": "acme.example",
				"trust": "verified",
				"lapsed": false
			},
			"seen_at": "2026-09-14T09:12:03Z"
		},
		{
			"property": "markets",
			"value": "TR",
			"source": {
				"name": "acme.example",
				"trust": "verified",
				"lapsed": false
			},
			"seen_at": "2026-09-14T09:12:03Z"
		},
		{
			"property": "markets",
			"value": "DE",
			"source": {
				"name": "acme.example",
				"trust": "verified",
				"lapsed": false
			},
			"seen_at": "2026-09-14T09:12:03Z"
		},
		{
			"property": "name",
			"value": "Acme Trail Jacket, navy, M",
			"lang": "en",
			"source": {
				"name": "shop.example",
				"trust": "unverified",
				"lapsed": true
			},
			"seen_at": "2026-08-02T17:41:55Z"
		},
		{
			"property": "media",
			"value": {
				"sha256": "e3943ea26ce08ae81809e62936dc4f934fa04da6cd57bd9ab2a90b79da751c09",
				"url": "https://acme.example/img/tj2041-navy.webp",
				"media_url": "https://media.prodid.org/sha256/e3943ea26ce08ae81809e62936dc4f934fa04da6cd57bd9ab2a90b79da751c09",
				"license": "CC-BY-4.0",
				"kind": "image"
			},
			"source": {
				"name": "acme.example",
				"trust": "verified",
				"lapsed": false
			},
			"seen_at": "2026-09-14T09:12:03Z"
		}
	]
}
